<?xml version = "1.0"  encoding = "utf-8"?>

<!-- planes.xml - A document that lists ads for 
       used airplanes -->

<!DOCTYPE organization-list.xml SYSTEM "organization-list.dtd">
 
    <SDSMT_Organizations>
	   <organization>
            <name>a name</name>
            <icon>a icon address</icon>
            <advisor>a advisor</advisor>
            <president>a president</president>
            <officers>a officer</officers>
            <members>a members list</members>
            <description>a description</description>
        </organization>
        <organization>
            <name>c name2</name>
            <icon>c icon address2 </icon>
            <advisor>c advisor2 </advisor>
            <president>c president2 </president>
            <officers>c officer2 </officers>
            <members>c members list2 </members>
            <description>c description2 </description>
        </organization>
        <organization>
            <name>b name2</name>
            <icon>b icon address2 </icon>
            <advisor>b advisor2 </advisor>
            <president>b president2 </president>
            <officers>b officer2 </officers>
            <members>b members list2 </members>
            <description>b description2 </description>
        </organization>
        <organization>
            <name>f name2</name>
            <icon>f icon address2 </icon>
            <advisor>f advisor2 </advisor>
            <president>f president2 </president>
            <officers>f officer2 </officers>
            <members>f members list2 </members>
            <description>f description2 </description>
        </organization>
	</SDSMT_Organizations>
